{
  "$schema": "https://json-schema.org/draft/2020-12/schema",
  "$id": "https://agent-smith.dev/contracts/review-integration/v2/schemas/capture-result-dry-run.schema.json",
  "title": "Agent Smith capture-result admission dry run",
  "type": "object",
  "additionalProperties": false,
  "required": ["schema", "operation", "validation", "lineage_id", "lens", "selected_order", "subject_hash"],
  "properties": {
    "schema": {"const": "agent-smith.review-capture-result-dry-run/v1"},
    "operation": {"const": "review/capture-result"},
    "validation": {"const": "accepted"},
    "lineage_id": {"type": "string", "pattern": "^[a-z0-9]+(?:-[a-z0-9]+)*$"},
    "lens": {"enum": ["risk", "resilience", "readability", "reliability", "review-risk", "review-resilience", "review-readability", "review-reliability"]},
    "selected_order": {"type": "integer", "minimum": 0, "maximum": 3},
    "subject_hash": {"$ref": "#/$defs/sha256"},
    "admission_decision": {"const": "completed"}
  },
  "$defs": {
    "sha256": {"type": "string", "pattern": "^sha256:[0-9a-f]{64}$"}
  }
}

